{
  "id": "urn:moca:handbook:platform-engineering",
  "version": "1.0.0",
  "title": "Platform Engineering Handbook",
  "description": "Composition-only handbook package demonstrating composition.members (core §10).",
  "canonicalDigest": {
    "algorithm": "sha256",
    "value": "95299793c00b9e990cd2a88c747085982c98a0a24ec6559d5d4d7f9f6f492387"
  },
  "composition": {
    "members": [
      { "id": "urn:moca:chapter:service-ownership", "version": "^1.0.0", "order": 1 },
      { "id": "urn:moca:chapter:incident-response", "version": "^1.0.0", "order": 2 }
    ]
  }
}
