{
  "$schema": "https://openmoca.org/schemas/core/moca.schema.json",
  "@context": {
    "moca": "https://openmoca.org/vocab/core#",
    "education": "https://openmoca.org/vocab/education#",
    "skos": "http://www.w3.org/2004/02/skos/core#",
    "ex": "https://example.org/vocab#",
    "ex-comp": "https://example.org/competencies#"
  },
  "id": "urn:moca:example:education-profile",
  "version": "1.0.0",
  "title": "Education Profile Example",
  "description": "MOCA package declaring the education profile: profileData.education, the education:competencies ontology role, and a tutoring skill with metadata.competencies.",
  "license": "Apache-2.0",
  "profile": [
    "https://openmoca.org/profiles/education/v1"
  ],
  "ontologies": {
    "education:competencies": {
      "iri": "https://example.org/curriculum/competencies",
      "role": "education:competencies",
      "format": "skos",
      "uri": "./ontologies/competencies.jsonld"
    }
  },
  "entryConcepts": [
    "ex:Microservices"
  ],
  "profileData": {
    "education": {
      "level": "undergraduate",
      "subject": "Computer Science",
      "estimatedDuration": "PT4H30M",
      "learningObjectives": [
        {
          "id": "urn:lo:001",
          "statement": "Explain the tradeoffs between horizontal and vertical scaling.",
          "competencies": [
            "ex-comp:SystemDesignFundamentals"
          ],
          "concepts": [
            "ex:Microservices"
          ]
        }
      ],
      "assessment": {
        "type": "formative",
        "linkedNodes": [
          "urn:node:microservices-intro"
        ]
      }
    }
  },
  "signature": {
    "type": "dsse",
    "value": "eyJwYXlsb2FkIjoiZXlKZmRIbHdaU0k2SW1oMGRIQnpPaTh2YVc0dGRHOTBieTVwYnk5VGRHRjBaVzFsYm5RdmRqRWlMQ0p6ZFdKcVpXTjBJanBiZXlKdVlXMWxJam9pZFhKdU9tMXZZMkU2WlhoaGJYQnNaVHBsWkhWallYUnBiMjR0Y0hKdlptbHNaVUF4TGpBdU1DSXNJbVJwWjJWemRDSTZleUp6YUdFeU5UWWlPaUpoWTJGaFltWTVNRFV5WTJObU9EVmxNR1poTlRSaU9UUmlZakppWVRVd01qRXdOMlkxTlRObU5UQmxNakk0TW1JMFptTXlNak5pWVRKbE1EQXpNemd4SW4xOVhTd2ljSEpsWkdsallYUmxWSGx3WlNJNkltaDBkSEJ6T2k4dmIzQmxibTF2WTJFdWIzSm5MMkYwZEdWemRHRjBhVzl1Y3k5d1lXTnJZV2RsTFhOcFoyNWhkSFZ5WlM5Mk1TSXNJbkJ5WldScFkyRjBaU0k2ZTMxOSIsInBheWxvYWRUeXBlIjoiYXBwbGljYXRpb24vdm5kLmluLXRvdG8ranNvbiIsInNpZ25hdHVyZXMiOlt7ImtleWlkIjoibW9jYS1zcGVjLWV4YW1wbGUtc2lnbmluZy1rZXktMjAyNiIsInNpZyI6Iit3S2lzMC9TM3dlYnFuTStaNXArcjBGcyt6NXBnUDJCZjdkMnBkUmorOTRyV1BDekJINUZGRjNYd1hhbUZsZXVROXdwdkRFU0FvUE9WZ2MvSmtCcUNBPT0ifV19",
    "keyid": "moca-spec-example-signing-key-2026"
  },
  "canonicalDigest": {
    "algorithm": "sha256",
    "value": "acaabf9052ccf85e0fa54b94bb2ba502107f553f50e2282b4fc223ba2e003381"
  }
}
